{"ambitions":[{"available":true,"icon":"flag","id":"career","kind":"career","name":"Build a career","targetId":"senior_engineer"},{"available":true,"icon":"flag","id":"homeowner","kind":"homeowner","name":"Become a homeowner","targetId":"small_house"},{"available":true,"icon":"flag","id":"garage","kind":"garage","name":"Build a garage","targetId":"vehicles"},{"available":true,"icon":"flag","id":"lifetime","kind":"age_limit","name":"Complete a lifetime","targetId":""}],"careers":[{"available":true,"icon":"briefcase","id":"survival","name":"A beginning"},{"available":true,"icon":"briefcase","id":"delivery","name":"Delivery"},{"available":true,"icon":"briefcase","id":"freelance","name":"Freelance"},{"available":true,"icon":"briefcase","id":"trades","name":"Trades"},{"available":true,"icon":"briefcase","id":"technology","name":"Technology"},{"available":true,"icon":"briefcase","id":"business","name":"Business"},{"available":true,"icon":"briefcase","id":"healthcare","name":"Healthcare"},{"available":true,"icon":"briefcase","id":"engineering","name":"Engineering"},{"available":true,"icon":"briefcase","id":"creative","name":"Creative"}],"colleges":[{"available":true,"icon":"school","id":"riverside","name":"Riverside College","qualificationIds":["computing_degree","business_degree","nursing_degree","engineering_degree","design_certificate"]},{"available":true,"icon":"school","id":"oak_trade","name":"Oak Trade Institute","qualificationIds":["trade_certificate"]}],"economy":{"ageBands":[{"basalHunger":4,"healthLoss":0,"startAge":18},{"basalHunger":5,"healthLoss":5,"startAge":40},{"basalHunger":6,"healthLoss":15,"startAge":60},{"basalHunger":7,"healthLoss":30,"startAge":75},{"basalHunger":8,"healthLoss":50,"startAge":90}],"bankAnnualNumeratorCap":"20000000","bankDenominator":146000,"bankMinimumDeposit":"100","bankNumeratorBase":4,"bankNumeratorExcess":1,"bankTier":"500000","bankUnlockEarned":"10000","checkupHealth":3000,"checkupPrice":"250","dailyBurst":8,"dailyRate":4,"daysPerYear":365,"endAge":100,"maximumOfflineDays":1200,"maximumWeekDays":7,"restHealth":400,"restSanity":25,"startAge":18,"starterJobId":"begging","startingHealth":10000,"startingHunger":100,"startingSanity":100,"studySanity":2,"studyStrain":1,"workWeekUnlockDays":200},"goals":[{"available":true,"icon":"flag","id":"buy_bike","kind":"own_item","name":"Save for a bike","targetAmount":"1","targetId":"bike"},{"available":true,"icon":"flag","id":"buy_small_house","kind":"own_item","name":"Save for a home","targetAmount":"1","targetId":"small_house"},{"available":true,"icon":"flag","id":"buy_villa","kind":"own_item","name":"Save for a villa","targetAmount":"1","targetId":"villa"},{"available":true,"icon":"flag","id":"buy_private_jet","kind":"own_item","name":"Save for a private jet","targetAmount":"1","targetId":"private_jet"},{"available":true,"icon":"school","id":"graduate_computing_degree","kind":"qualification","name":"Graduate in Computing","targetAmount":"1","targetId":"computing_degree"},{"available":true,"icon":"school","id":"graduate_trade_certificate","kind":"qualification","name":"Qualify in Trades","targetAmount":"1","targetId":"trade_certificate"}],"items":[{"available":true,"category":"food","effect":"food","hungerRestore":25,"icon":"bag","id":"bread","name":"Bread","price":"25","requirements":{"itemIds":[]}},{"available":true,"category":"food","effect":"food","hungerRestore":80,"icon":"bag","id":"meal","name":"Full meal","price":"100","requirements":{"itemIds":[]}},{"available":true,"category":"food","effect":"food","hungerRestore":100,"icon":"bag","id":"premium_meal","name":"Premium meal","price":"180","requirements":{"itemIds":[]}},{"available":true,"category":"vehicles","effect":"unlock","icon":"car","id":"bike","name":"Bike","price":"2500","requirements":{"itemIds":[]}},{"available":true,"category":"equipment","effect":"unlock","icon":"bag","id":"delivery_kit","name":"Delivery kit","price":"10000","requirements":{"itemIds":[]}},{"available":true,"category":"equipment","effect":"unlock","icon":"bag","id":"trade_tools","name":"Trade tools","price":"15000","requirements":{"itemIds":[]}},{"available":true,"category":"technology","effect":"unlock","icon":"bag","id":"laptop","name":"Laptop","price":"45000","requirements":{"itemIds":[]}},{"available":true,"category":"housing","effect":"cosmetic","icon":"home","id":"room","name":"Room","price":"12000","requirements":{"itemIds":[]}},{"available":true,"category":"housing","effect":"cosmetic","icon":"home","id":"studio","name":"Studio","price":"60000","requirements":{"itemIds":[]}},{"available":true,"category":"housing","effect":"cosmetic","icon":"home","id":"apartment","name":"Apartment","price":"200000","requirements":{"itemIds":[]}},{"available":true,"category":"housing","effect":"cosmetic","icon":"home","id":"small_house","name":"Small House","price":"600000","requirements":{"itemIds":[]}},{"available":true,"category":"housing","effect":"cosmetic","icon":"home","id":"townhouse","name":"Townhouse","price":"1500000","requirements":{"itemIds":[]}},{"available":true,"category":"housing","effect":"cosmetic","icon":"home","id":"villa","name":"Villa","price":"4000000","requirements":{"itemIds":[]}},{"available":true,"category":"housing","effect":"cosmetic","icon":"home","id":"penthouse","name":"Penthouse","price":"7000000","requirements":{"itemIds":[]}},{"available":true,"category":"housing","effect":"cosmetic","icon":"home","id":"estate","name":"Estate","price":"12000000","requirements":{"itemIds":[]}},{"available":true,"category":"vehicles","effect":"cosmetic","icon":"car","id":"scooter","name":"Scooter","price":"18000","requirements":{"itemIds":[]}},{"available":true,"category":"vehicles","effect":"cosmetic","icon":"car","id":"used_car","name":"Used Car","price":"60000","requirements":{"itemIds":[]}},{"available":true,"category":"vehicles","effect":"cosmetic","icon":"car","id":"sedan","name":"Sedan","price":"180000","requirements":{"itemIds":[]}},{"available":true,"category":"vehicles","effect":"cosmetic","icon":"car","id":"suv","name":"Suv","price":"350000","requirements":{"itemIds":[]}},{"available":true,"category":"vehicles","effect":"cosmetic","icon":"car","id":"sports_car","name":"Sports Car","price":"700000","requirements":{"itemIds":[]}},{"available":true,"category":"vehicles","effect":"cosmetic","icon":"car","id":"luxury_car","name":"Luxury Car","price":"1200000","requirements":{"itemIds":[]}},{"available":true,"category":"vehicles","effect":"cosmetic","icon":"car","id":"supercar","name":"Supercar","price":"2500000","requirements":{"itemIds":[]}},{"available":true,"category":"motorcycles","effect":"cosmetic","icon":"bag","id":"starter_motorcycle","name":"Starter Motorcycle","price":"25000","requirements":{"itemIds":[]}},{"available":true,"category":"motorcycles","effect":"cosmetic","icon":"bag","id":"touring_motorcycle","name":"Touring Motorcycle","price":"100000","requirements":{"itemIds":[]}},{"available":true,"category":"motorcycles","effect":"cosmetic","icon":"bag","id":"premium_motorcycle","name":"Premium Motorcycle","price":"300000","requirements":{"itemIds":[]}},{"available":true,"category":"technology","effect":"cosmetic","icon":"bag","id":"smartphone","name":"Smartphone","price":"8000","requirements":{"itemIds":[]}},{"available":true,"category":"technology","effect":"cosmetic","icon":"bag","id":"tablet","name":"Tablet","price":"15000","requirements":{"itemIds":[]}},{"available":true,"category":"technology","effect":"cosmetic","icon":"bag","id":"gaming_pc","name":"Gaming Pc","price":"80000","requirements":{"itemIds":[]}},{"available":true,"category":"technology","effect":"cosmetic","icon":"bag","id":"workstation","name":"Workstation","price":"150000","requirements":{"itemIds":[]}},{"available":true,"category":"technology","effect":"cosmetic","icon":"bag","id":"home_cinema","name":"Home Cinema","price":"250000","requirements":{"itemIds":[]}},{"available":true,"category":"jewelry","effect":"cosmetic","icon":"bag","id":"everyday_watch","name":"Everyday Watch","price":"5000","requirements":{"itemIds":[]}},{"available":true,"category":"jewelry","effect":"cosmetic","icon":"bag","id":"mechanical_watch","name":"Mechanical Watch","price":"40000","requirements":{"itemIds":[]}},{"available":true,"category":"jewelry","effect":"cosmetic","icon":"bag","id":"necklace","name":"Necklace","price":"60000","requirements":{"itemIds":[]}},{"available":true,"category":"jewelry","effect":"cosmetic","icon":"bag","id":"ring","name":"Ring","price":"100000","requirements":{"itemIds":[]}},{"available":true,"category":"jewelry","effect":"cosmetic","icon":"bag","id":"luxury_watch","name":"Luxury Watch","price":"400000","requirements":{"itemIds":[]}},{"available":true,"category":"fashion","effect":"cosmetic","icon":"bag","id":"casual_outfit","name":"Casual Outfit","price":"2000","requirements":{"itemIds":[]}},{"available":true,"category":"fashion","effect":"cosmetic","icon":"bag","id":"tailored_suit","name":"Tailored Suit","price":"20000","requirements":{"itemIds":[]}},{"available":true,"category":"fashion","effect":"cosmetic","icon":"bag","id":"designer_outfit","name":"Designer Outfit","price":"100000","requirements":{"itemIds":[]}},{"available":true,"category":"furnishings","effect":"cosmetic","icon":"bag","id":"bed","name":"Bed","price":"15000","requirements":{"itemIds":[]}},{"available":true,"category":"furnishings","effect":"cosmetic","icon":"bag","id":"desk","name":"Desk","price":"20000","requirements":{"itemIds":[]}},{"available":true,"category":"furnishings","effect":"cosmetic","icon":"bag","id":"sofa","name":"Sofa","price":"35000","requirements":{"itemIds":[]}},{"available":true,"category":"furnishings","effect":"cosmetic","icon":"bag","id":"artwork","name":"Artwork","price":"120000","requirements":{"itemIds":[]}},{"available":true,"category":"furnishings","effect":"cosmetic","icon":"bag","id":"music_room","name":"Music Room","price":"300000","requirements":{"itemIds":[]}},{"available":true,"category":"hobbi